"budapest.uni-foundation.eu","Basic PHP","en","PHP01",6,"en","Introduction to PHP programming, including syntax, variables, functions, and control structures.","en","Students will be able to write basic PHP scripts, manipulate data, and understand server-side programming concepts.","en","1/2","Assessment through coding exercises, mini-projects, and quizzes on PHP fundamentals.","en","References: Official PHP documentation and online tutorials.","en","Offered each semester for backend students.","en","Topics: PHP syntax, variables, functions, loops, conditionals, and basic form handling.","en","0613",,,,"Basic HTML knowledge recommended.","en","BACKEND","1/3","1",,,,"0",0,"Delivered via lectures and hands-on coding labs.","en",,,
"budapest.uni-foundation.eu","Intermediate PHP","en","PHP02",6,"en","Covers intermediate PHP topics such as object-oriented programming, sessions, cookies, and form handling.","en","Students will be able to develop dynamic web applications with PHP, manage sessions, and use OOP concepts.","en","2/2","Assessment through coding projects, exercises, and quizzes on PHP.","en","References: PHP official documentation and online tutorials.","en","Offered every semester for backend students.","en","Topics: OOP, sessions, cookies, form handling, and data validation in PHP.","en","0613",,,,"Completion of Basic PHP recommended.","en","BACKEND","1/3","1",,,,"0",0,"Delivered via lectures, coding exercises, and hands-on projects.","en",,,
"budapest.uni-foundation.eu","SQL Databases I","en","SQL01",6,"en","Introduction to SQL databases, covering basic queries, data manipulation, and relational database concepts.","en","Students will be able to write SQL queries, create tables, and manipulate relational data.","en","2/2","Assessment includes exercises, practical tasks, and quizzes on SQL fundamentals.","en","References: SQL tutorials, online guides, and database textbooks.","en","Available each semester for backend students.","en","Topics: SELECT, INSERT, UPDATE, DELETE, table creation, and basic joins.","en","0612",,,,"Basic PHP knowledge recommended.","en","BACKEND","1/3","1",,,,"0",0,"Delivered via lectures, hands-on labs, and exercises.","en",,,
"budapest.uni-foundation.eu","Advanced PHP I","en","PHP03",6,"en","Advanced PHP topics including OOP, security, and database integration.","en","Students will be able to develop secure, object-oriented PHP applications and integrate with databases.","en","1/2","Assessment through projects, coding exercises, and quizzes.","en","References: PHP manual, online tutorials, and security guidelines.","en","Offered every semester for backend students.","en","Topics: advanced OOP, PDO, security, sessions, and database integration.","en","0613",,,,"Intermediate PHP recommended.","en","BACKEND","2/3","1",,,,"0",0,"Delivered via lectures, coding labs, and hands-on projects.","en",,,
"budapest.uni-foundation.eu","SQL Databases II","en","SQL02",6,"en","Advanced SQL topics including joins, subqueries, indexing, and transaction management.","en","Students will be able to design complex queries, optimize database performance, and manage transactions.","en","1/2","Assessment includes exercises, projects, and quizzes on advanced SQL.","en","References: SQL tutorials, database textbooks, and online guides.","en","Available each semester for backend students.","en","Topics: complex joins, subqueries, indexing, transactions, and database optimization.","en","0612",,,,"SQL Databases I recommended.","en","BACKEND","2/3","1",,,,"0",0,"Delivered via lectures, practical exercises, and guided labs.","en",,,
"budapest.uni-foundation.eu","Dependency Management","en","COMP01",6,"en","Introduction to dependency management in software projects, including package managers and version control integration.","en","Students will be able to manage project dependencies, use package managers, and maintain consistent development environments.","en","1/2","Assessment through exercises, practical tasks, and quizzes on dependency management.","en","References: Composer, NPM documentation, and online guides.","en","Offered every semester for backend students.","en","Topics: Composer, NPM, package versioning, and dependency resolution.","en","0613",,,,"Intermediate PHP and SQL knowledge recommended.","en","BACKEND","2/3","1",,,,"0",0,"Delivered via lectures, coding labs, and guided exercises.","en",,,
"budapest.uni-foundation.eu","Advanced PHP II","en","PHP04",6,"en","Covers advanced PHP programming including design patterns, security, and performance optimization.","en","Students will be able to implement secure, efficient, and maintainable PHP applications using advanced techniques.","en","2/2","Assessment includes coding projects, exercises, and quizzes on advanced PHP topics.","en","References: PHP documentation, design patterns books, and online tutorials.","en","Offered each semester for backend students.","en","Topics: design patterns, security, performance optimization, and advanced PHP techniques.","en","0613",,,,"Advanced PHP I recommended.","en","BACKEND","2/3","1",,,,"0",0,"Delivered via lectures, coding labs, and hands-on projects.","en",,,
"budapest.uni-foundation.eu","PHP Frameworks","en","PHPFW01",6,"en","Introduction to popular PHP frameworks like Laravel and Symfony, including MVC architecture and routing.","en","Students will be able to develop web applications using PHP frameworks, implement MVC patterns, and manage routes and controllers.","en","2/2","Assessment through framework projects, exercises, and quizzes.","en","References: Laravel and Symfony documentation, online tutorials, and example projects.","en","Available each semester for backend students.","en","Topics: MVC, routing, controllers, models, views, and framework setup.","en","0613",,,,"Advanced PHP knowledge recommended.","en","BACKEND","2/3","1",,,,"0",0,"Delivered via lectures, coding labs, and hands-on framework projects.","en",,,
"budapest.uni-foundation.eu","Application architecture","en","ARCH01",6,"en","Covers principles of software architecture, including layered architecture, MVC, and service-oriented design.","en","Students will be able to design and implement web applications following architectural best practices.","en","2/2","Assessment includes design exercises, projects, and quizzes on architecture concepts.","en","References: Software architecture books and online resources.","en","Offered each semester for backend students.","en","Topics: layered architecture, MVC, service-oriented architecture, and best practices.","en","0613",,,,"Advanced PHP and SQL recommended.","en","BACKEND","2/3","1",,,,"0",0,"Delivered via lectures, guided exercises, and projects.","en",,,
"budapest.uni-foundation.eu","Templating languages","en","TPL01",6,"en","Covers templating languages such as Twig and Blade, including template inheritance and reusable components.","en","Students will be able to create dynamic web pages using templating languages and implement reusable components.","en","2/2","Assessment through exercises, projects, and quizzes on templating techniques.","en","References: Twig and Blade documentation, online tutorials, and examples.","en","Available each semester for backend students.","en","Topics: template syntax, inheritance, components, and dynamic content rendering.","en","0613",,,,"Intermediate PHP knowledge recommended.","en","BACKEND","2/3","1",,,,"0",0,"Delivered via lectures, coding exercises, and project-based learning.","en",,,
"budapest.uni-foundation.eu","CMS I","en","CMS01",6,"en","Introduction to content management systems (CMS), including setup, content creation, and administration.","en","Students will be able to set up and manage content within a CMS, understanding backend integration and templates.","en","1/2","Assessment includes CMS exercises, projects, and quizzes.","en","References: CMS official documentation and tutorials.","en","Available every semester for backend students.","en","Topics: CMS setup, content creation, templates, user management, and administration.","en","0613",,,,"Basic PHP knowledge recommended.","en","BACKEND","3/3","1",,,,"0",0,"Delivered via lectures and hands-on labs using CMS platforms.","en",,,
"budapest.uni-foundation.eu","JSON:API","en","API02",6,"en","Introduction to the JSON:API specification for building APIs, including request/response formats and conventions.","en","Students will be able to build APIs following the JSON:API specification and integrate them with web applications.","en","2/2","Assessment through exercises, projects, and quizzes on API implementation.","en","References: JSON:API official documentation, tutorials, and examples.","en","Offered each semester for backend students.","en","Topics: JSON:API structure, endpoints, relationships, and conventions.","en","0612",,,,"REST API knowledge recommended.","en","BACKEND","3/3","1",,,,"0",0,"Delivered via lectures, coding exercises, and hands-on projects.","en",,,
"budapest.uni-foundation.eu","CMS II","en","CMS02",6,"en","Advanced CMS topics including plugin development, theme customization, and performance optimization.","en","Students will be able to extend CMS functionality, customize themes, and optimize CMS performance.","en","2/2","Assessment includes CMS projects, coding exercises, and quizzes on advanced CMS concepts.","en","References: CMS documentation, plugin guides, and online tutorials.","en","Available each semester for backend students.","en","Topics: plugin development, theme customization, CMS optimization, and security.","en","0613",,,,"CMS I recommended.","en","BACKEND","3/3","1",,,,"0",0,"Delivered via lectures, labs, and guided CMS projects.","en",,,
"budapest.uni-foundation.eu","Optimization","en","CACHE",6,"en","Covers web application performance optimization, caching strategies, and resource management.","en","Students will be able to optimize web applications for performance, implement caching, and manage resources efficiently.","en","2/2","Assessment includes exercises, optimization projects, and quizzes.","en","References: online guides, performance testing tools, and tutorials.","en","Offered each semester for backend students.","en","Topics: caching, code optimization, resource management, and performance measurement.","en","0613",,,,"Advanced PHP and database knowledge recommended.","en","BACKEND","3/3","1",,,,"0",0,"Delivered via lectures, labs, and hands-on projects.","en",,,
